hello,hello to you too
*alcohol*,I will do that
alcohol,I want to try it
thank you,Happy to help you^always here for you^I got your back
*per1*,Excuses dont burn calories^Cutting calories doesnt start in the gym, it starts in your head with a decision^Every single day on diet is a win
*per2*,Dont stop when you are tired stop when you are done^Eating crappy food is not a reward but a punishment^Once on the lips forever on the hips
*per3 per4*,love is in the air
*per3_per4*,true love is in the air
DefaultResponse,Fed up
